titles,reviews
머니볼,"성공과 실패가 교차하는 순간들 실화를 바탕으로 만들어진 영화 '머니볼'. 이 영화는 굳이 극적인 요소, 자극적인 요소를 억지로 끼워넣지 않고 영화 내의 사건들을 담백하게 그려낸다. You are a loser, Just enjoy the show. 야구는 사랑하지 않을 수 없어 우리가 언더독을 응원하는 이유. 영화 머니볼 리뷰: 각색된 장면을 중심으로 소재, 내용, 연기, 표현 그리고 또. 하나하나 모두 비취향. 실화가 가지는 힘 뜨거운 성공 이면의 차가운 도전, 뜨거운 열정 이면의 차가운 고독. 언더독의 승리 방정식이 모두 담겨 있다 20년이 지난 지금 누군가는 또 다른 방식으로 접근하겠지 그 개혁도 이제는 있는 자의 차지이겠지만... 야구의 규칙 정도만 간신히 아는 나를 완벽하게 매료시킨 뛰어난 스포츠 드라마. 우리가 스포츠를 사랑할수밖에 없는 이유 ""just enjoy the show"" '야구'로 표현한 삶. 최고의 야구 영화가 될 수 있는 이유. 야구를 좋아했던 나의 전성기시절 실제 있었던 얘기를 너무나 재밌게 잘 만든 수작중에 수작이다 몇번을 봐도 재밌게 끝까지 보게되는 영화 브레드피트 대단한배우야 박찬호선수도 나와 ㅎ 너만의 게임을 해 야구는 기록경기. 야구사업도 기록에 투자하는 게임ㆍ 해고통보를 배우는 장면이 기억에 남는다. 의연한 척 통보하지만 긴장했고, 쿨하게 떠나던 방출선수의 모습에서 괜히 같이 안도하게 된.. 점점 성장해가는 데이터전문가의 현장적응기 느낌 마운드 뒷편에서 신념을 전력투구하다. 무엇보다 각본이 참 좋다 인생도 확률로 이어진다면 야구만큼 흥미로울까? “우리 인생의 ‘머니볼 이론’은 꽤 자주 맞았을지도” 길을 만들고 선택하고 감내하는 것. 야구를 넘어 인생을 담은 영화 차가운 통계와 그 속에 숨어있는 따뜻한 마음씨 최고의 자리에 가기위해서는 머니볼이 맞다. 현실이다. 모두가 언젠가 루저인 것을... 누군가를 신뢰한다는 건 누군가를 신뢰하는 나를 믿는 것. 그 사람의 성공도 실패도 다 내가 감당해야 한다는 것. 관리자의 역할도 쉽지는 않구나 지금까지 나오지 않은 전혀 새로운 소재의 영화. 야구를 좋아하는 내겐 정말 흥미로웠다. 흥미를 사랑으로 태우는 영화. 혹시 작가가 이현세의 공포의 외인구단을 읽고 영감을 받은게 아닌가한다 ㅎㅎ 소신과 객기는 증명의 유무에 따른 한 끗 차이. 영화보다 더 영화같았던 실화. 우리가 고민해야 할 문제는 이 방법을 믿느냐야 우리의 방식을 굳이 남에게 설명하려고 하지마 . 뭐든 해야 바뀐다. 야구 시장을 새롭게 접근하게끔 뒤바꿔 놓은 단장의 이야기. 야알못이라 그런가 애슬레틱스의 승리가 크게 와닿진 않았지만 이 영화가 결국 하려는 말은 꼴찌의 승리보다 'The Show'의 가사와 빌의 선택에 담겨있는것 같다 공보다 늦게 따라오는 그림자처럼, 속력을 따라가지 못하는 소리처럼. 이미 그곳에 있다. 브래드 피트의 미친 연기력 “야구는 사랑하지 않을 수가 없어.“ 확신이 있다면 즐길 일만 남는다 스포츠물 영화 중에 최애 야구를 몰라서 일까? 미국 리그 경기에, 모르는 선수연혁들, 기존 룰에 반한 구태에 대한 반란은 알겠다만 후반 홈런씬정도만 시원하고 스토리 몰입도 재미도 못느꼈다. 미국의 영웅주의… 아니 아메리칸 드림이라고 해야 할듯. 실화에 바탕을 두었다곤 하나… 글쎄… 공감하기엔 부족 허나, 인간의 의지와 좌절에 관해선 눈물이 찔금… 가성비, 데이터의 힘과 한계를 정확하게 드러낸다 감동이 있는 명화입니다. 거대하고 오래된 무언가에 혁신을 가져오는 것은 대상에 대한 사랑이 아닐까. 그것이 재미이던 애증이던 내가 야구를 사랑할 수밖에 없는 이유"
양들의 침묵,"그당시엔 꽤나 충격적인 연쇄살인마 영화 스토리를아는데도볼대마다새로와요 지금까지 본 스릴러 영화 중 가장 매력적인 빌런. 한니발이 옥중에서도 드러내는 포스에 압도당한다. 분위기가 자아내는 숨막힘 해외 공포영화중. 최고라고. 말할수있음!!! 강추!!! 색다른 느낌으로 기억에 남아 있다. 이 영화를 보게 된 시점부터 범죄 스릴러 장르를 좋아하게 됐다. 안소니 홉킨스의 분량이 얼마 되지 않는다는 걸 알았을 때의 큰 놀라움. 영화 양들의 침묵는 전혀 군더더기가 없는 범죄 스릴러의 교과서이다. 조디 포스터와 안소니 홉킨스의 긴장감 그리고 공포심이 아직도 온 몸에 핏줄을 타고 흐르는 것 같은 느낌이다. 한니발만큼 무서운 빌런이 있다면 어디 한번 소개해주게나 이름값 대비 아쉬웠던 영화, 어쩔 수 없는 옛날 영화라 그런가 역사상 가장 떨리는 영화 싸이코패스인 렉터박사가 상상도 못한 방법으로 살인을 저지르고 스털링과 고도의 심리전을 벌이는 범죄스릴러의 최고봉 악인과 선인의 시점쇼트 둘 다 섬뜩하게 능하다. 기가 센 사람은 단지 눈빛만으로 그 사람을 압도한다. 배우들의 연기, 몇몇 대사와 연출 만으로도 훌륭하다. 범죄 스릴러물의 교본, 끌리는 빌런과 진취적 여성의 탄생 움직임 없이 말로만 긴장감을 만드는 장면과 말 한 마디 없이 움직임만으로 긴장감을 만드는 장면이 한 영화에서 나온다는 사실. 압도적인 한니발과 긴장감 있는 연출, 클래식은 영원하다 마지막 5분 남기고 본걸 개후회할뻔했다 훌륭한 연출보다 더 대단한 캐릭터의 매력 어릴때는 무서워서 덜덜 떨며봤는데 최근에 다시보니 역시 명작. 안소니홉킨스의 연기 명불허전. 요즘은 왜 이런영화 찾기가 힘든지. 시간을 초월해 명작으로 남은데는 다 이유가 있는듯 처음부터 끝까지 흡입력이 장난아님 안소니 홉킨스의 미친연기도 감탄만 나온다 오래전 영화지만 당시에 엄청난 화재가 되었던 영화로 소설의 영화화지만 배우들의 연기와 탄탄한 스토리가 최고로 좋았다 충격적인 장면도 많았다 연기가 압도적이다 본 중에서 가장 소름돋는 연기 끝내주는 한니발 배우들의 연기력으로 이끌어낸 과감한 연출 . 7월15일 CGV재개봉으로 재관람 . 정말 잘 만든 '스릴러' 지나치게 자극적인 영화보다 심도있는 완성도의 심리 스릴러 미친 연기력과 높은 몰입도. 30년 지난 지금보더라도 촌스럽다는 생각 별로 안들걸? 솔직히 지금 보면 지루함, 근데 배우의 연기력이 그 지루함을 긴장감으로 바꾼다 한니발이 나올때마다 숨이 멎을듯한 긴장감 스릴러장르 추천하면 거의 빼놓지않고보이는 갓작품 이거만한게없다... 안소니 홉킨스의 소름돋는 연기력과 잘 짜여진 스토리로 집중하게 한다 우아한 침착함의 한니발과 뜨거운 침착함의 스털링. 극과 극은 가장 가깝다 섬찟섬찟 쫄깃쫄깃. 奇異는 만들어지는 것이 아니라 이미 존재하는 것. 애초에 존재해 모든 것을 집어삼킨다. 치밀하게 쌓아 올리는 스릴과 모든걸 압도하는 한니발의 카리스마 한니발 렉터. 책도 영화도 명작. 사이코패스에게 프러파일링 당하는 여수사관. 빼어난 캐릭터 구성과 훌륭하게 갖춰진 이야기로 팽팽한 긴장감을 이어가는 탁월한 스릴러 영화. 스릴러가 만들어낼 수 있는 하나의 경지. 내러티브, 미장센, 촬영, 음향, 연기에 연출력 등 경이로운 리듬이 돋보이는 걸작. 영화를 입문하고 싶은 사람은 꼭 봐야할 작품 중 한편 심리영화장르로는 처음 접한. 처음부터 끝까지 강렬했다. 명작이지....홉킨스 압도적인 아우라! 그리고 완벽한 앙상블. 작품에서 느끼는 공포감 특히 어두운 장면에서 범인과 공존했던 공간은 공포감에 극치였다 누에를 찢고 나오는 섬뜩함 기대가 너무 거대했다"
브레이킹 배드 시즌 1,"브레이킹 배드 시즌1 = 1~5화 까지 지루한 걸 참아내면 6화부터 엄청난 일이 벌어진다. 브레이킹배드 완전 인생드라마입니다 걍 엄청난 건지는 모르겠는데?라는 생각이 든 순간 시즌 2를 보고 있었다. 남들 지루하다는 시즌 초반도 난 존잼 이었음. 도대체 이게 왜 100점이 아닌거냐 내 인생에서 최고의 작품 확 잡아당기는 스토리, 과감한 전개, 훌륭한 연기. 다음 시즌을 저절로 보게 만드는 흡입력. 브레이킹 배드 시즌1 은 브레이킹배드 전체 중 조금 루즈했습니다.. 하지만! 안볼수는 없는 작품이죠. 말이 필요없는 인생 미드 지루하지만 개연성과 현실성 하나만큼은 칼같이 지켰다. 억지재미로 화면을 덮으면서 개연성과 현실성을 옆집 개의 먹이로 주는 작품보다는 훨씬 낫다. 얽히고 설킨 하이젠버그 특별하진 않지만 이끌린다 하이젠버그의 탄생기 마약 딜러에 관한 새로운 시각의 미드 3화까지만 참으면 시즌5까지 하이웨이 와 내가 이 대명작을 이제 알현하다니 할거임 코미디 요소가 많은 라이트 미드 스스로가 못미더운 인간이 기회를 저버리는 방식 화공과 학생으로서 부심이 폭.발.한.다. 그저 GOAT 미드하면 생각나는 작품 중 하나,초반만 잘 넘기면 시리즈 다 보게 됨 그냥 마약파는 드라마인줄만 알았다. 드라마, 주제, 액션, 연기, 디테일까지 완벽. 어? 몇일이 지난거지? 영화로 나왔다면 더 좋았을텐데 . 드라마란 이런것.캐릭터의 변화와 이야기의 변화가 너무나 극적으로 변화한다 '화이트'가 '하이젠버그'로 되기까지 한두시간의 어리둥절함을 견디면 역대 최고의 시리즈가 펼쳐진다 솔직히 시즌1은 지루해서 다 보는데 시간이 오래 걸렸지만 시즌5까지 다 보고 나면 시즌1부터 스토리가 탄탄하고 세밀하게 구성되어 있음을 알 수 있다. 베스트5안에드는 미드 스토리의 몰입도가 여태본미드 중에 최고임 이야 여기는 오프닝 맛집이네 마약으로 배우는 신나는 화학교실!! 제목 그대로 멈출수 없는 마력같은 드라마 죽음이 다가오자, 도덕은 달아났다. 시작은 미약하지만 끝은 창대하리라 가족에 대한 광기, 돈에 대한 광기, 인정에 대한 광기, 무엇이 그를 괴물로 만들었을까 장대한 시작을 알리는 가장 정석에 가까운 방법. 인물의 극단적 변화 두번 다시 화학 선생을 무시하지마라. 제시와 하이젠버그의 마약 제조기의 서막. 명실상부 최고의 미드 중 하나 굿 힘들때 보면 더 힘들지만 도움되는 드라마 다음 시즌에도 살아남는 거죠? 시작부터 주인공의 바지를 벗긴 건 니가 처음이야... 빠져든다. 왜 이제 봤을까 꽤 많은 시청자들이 인생드라마로 꼽는 이유를 알겠는데 그 대열에 동참하기가 쉽지는 않을 것. 인생작을 만나게 해준 넷플릭스에 감사를... 이 드라마는 미쳤다 크랜스톤 최고의 캐릭터 익스트림한 첫 착장🩲 의외로 차분한 전개. 꼬이고 풀리는 것만으로도 꿀잼 연재 쌉가능! 자가규정이라는 지옥에 갇힌 우리 이게... 명작의 맛인가... 츄릅 드라마에 대한 호기심을 완벽히 끌어올려 놓음 마약 범죄 이야기! 화학샘의 마약 성장기?가 재밌당"
나 혼자 산다,"출연자에 따라 호불호가 강하게 갈리는 프로그램. 처음 기획의도와 맞는 출연진이라면 흥미롭다. 옛날에는 재미가득, 웃음가득 지금은 논란가득, 가식가득... 나 이만큼 산다 폼이 좀 오락가락하지만 여전히 재밌는 예능 박나래씨의 활약을 좋아합니다. 솔직히 남자 패널들은 키씨, 코쿤씨 제외 그냥 그래요. 지저분하고 예의없는 사람의 일상이 궁금하진 않습니다. 최애 예능 보여주기식으로 변해가서 본질을 흐리고 있지만 기안84, 김대호가 진정한 나혼산으로 살리고 있다 4점에서 1점으로 바꾸고 박나래님 하차할 때 다시 평가하겠습니다. 더 이상 나혼자 살지 않아서 문제. 거기다가 몇 명의 발언들은 문제가 많다. 나혼자 살지 않기에 더 이상 보고 싶지 않다. 논란과 가식만 가득... 시간이 지날수록 남들과 달라야한다는 집착에 빠지지 않는지. 점점 퇴물로 게스트 없으면 이제 보기 애매함.. 초기때 생날것의 자취라이프라면 이젠 사람들이 '나혼자 살잔다'라고 부르는건 말이 괜히 있는게 아님 온가족이 볼수 있는 프로그램중 하나 우리애가 참 좋아해요 ㅋㅋㅋㅋㅋ 아직도하다니...... 처음 기획의도는 좋았으나, 갈수록 연예인들의 초호화 삶을 보여주기 위한 방송임 관찰형 예능 이제 지겨움 갈수록 떨어트리고 싶은 별점.. 이건 시즌제로 돌렸어야 했다. 프로그램의 본질은 잃어가는 것 같지만 재밌다 좋아하는 연예인이 어떻게 사는지 궁금할때 최고 워라밸을 잘하는 크루의 일상 이야기는 또다른 동기부여가 되기도함 가끔 보면 재미있어요 팜유 너무 웃겨요 ㅋㅋㅋㅋㅋ 최근 회복되는가 싶더니 더이상의 나혼자 산다의 명성은 없는걸까요 같은 소재만 몇번째😅 이제는 우리가 헤어져야 할 시간 아닐까 내 금요일 최애 프로 맨날 나오는 사람들만 나올 때가 가장 아쉬움 재미는 있지만 어느순간 프로그램의 방향성이 헷갈리기 시작함 나 혼자 살지만 이걸 보면서 위로 받았던 기억은 별로 없었다. 바쁘다 비뻐ㅜ현대사회 도시인의 라디프 연예인의 사생활 침해 혼자봐라 인생 재밌게 사네... 돈 많은 놈들. 멋지게, 이쁘게 나오려고 하는 연예인들 패스하고, 재밌는 부분만 보면 재밌음 관찰 예능 붐의 시작. 그리고 혼밥, 혼영, 혼술.. ‘혼자’가 더 이상 외로움이 아닌 자유, 나만의 시간이라는 단어로 자리잡는 데에 한몫했다. 지금 라인업은 다 죽어가던 나 혼자 산다도 살려냈다. . 가난한 사람들의 자리가 사라지고, 잘 사는 사람들만 나와서 요즘은 골라서 봅니다. 의견없음 재밌게 보고있지만, 그 재미중에 ppl을 찾는 재미도 있다는거- 진솔함이 정말 있는걸까 싶지만 연예인 보는 재미로 본다. 예전에 재미있었다 나름 신선했고 사람냄새가 났다 하지만 지금은 연예인 이미지 관리?느낌 그리고 중간 중간에 너무 코멘트가 많다 재미는 완전히 사라진 느낌"
펄프 픽션,"왜 극찬을 받는 영화인지는 잘 모르겠다. 저렴한데 저렴한 느낌이 없는 명품 신파극이랄까? 94년 개봉당시엔 파격적인 영화였겠지만 20년지난 지금은, 그간 패러디와 오마쥬로 익숙한듯, 친숙하지 않은, 특이한듯 평이함... 분명 아무 생각 없이 자극적인 재료를 머리속에 탈탈 넣었는데 완성되고나니 뭔가 완벽히 계량된것만 같은 자극적이면서도 담백한 요리가 되어있었다. 쿠엔틴타란티노에서만 느낄수 있는 타락적이고 피비릿내나는 분 위기가 최고 쿠엔틴의 영화는 많은 생각을 할 필요없이 단지 즐기면 된다. 피터지고 말이 거칠어도 거부하지 말아라. 그러는 순간 당연히 부정적으로 밖에 안보일 것이다. 유쾌하고 신나는 노래, ... 뭔가 싶지만 재미는 보장하는 영화 존트라볼타 개핫하다 타란티노작품은 한시간은 졸면서 체력을 비축해놓은 후 마지막한시간에 쏟아지는 것들을 정신없이 받아내다가 끝난다 B급인척 떡칠해봤자 태가난다 핏기와 재치로 번뜩이는 싸구려 잡지 유광 페이지의 맛 에스겔서 25장 17절을 찾아볼 줄이야. 제목이 신의 한 수. 찰진 극본이 편집과 액팅의 1급 앙상블로 살아나게 창조한 쿠엔틴 타란티노! 끝까지 생생하다. 1994. 4.0. 줄스와 빈센트가 티격태격대는 모습이 너무 웃김 ㅋㅋㅋ 영화가 순서대로 가는 게 아니라 마구잡이로 여러 이야기가 섞여 있음에도 전혀 어색하다는 걸 느끼지 못 했다. 깊게 들어가는 것보다는 즐기면서 보면 만족할 영화라고 생각한다. 막상 특출난 것 없는 스토리인데 연출로 특출난 영화를 만들어 버렸네 형식의 틀을 깬 기상천외하고 재밌는 작품 세상 쿨하게 타란티노 영화철학의 근간을 확인한다. 거침없고 막힘없는 달변가의 술자리 싸구려 무용담의 향연 제멋대로 꿰어도 훌륭한 진주 목걸이 잉글리시 마더뻐커 잉글리시!! 수 많은 영화의 재미 중에 '몰입'이라는 것이 주는 재미. 블랙 코미디 안에서도 캐릭터를 잃지 않는 법. 모든 인물의 모든 대사와 행동이 잊혀지지 않게 하는 법. 쿠엔틴의 빌드업용 실험작. 골때리는 전개가 참 ㅋㅋㅋ 다른 시간대의 인물들이 교묘하게 이야기를 쌓아간다. 무슨 내용인지 모르겠다면, 그게 진짜 이 영화의 매력이다. 타란티노 최고의 영화 양서를 이기는 싸구려 잡지의 매력. 뒤죽박죽 시간 구성이 참 매력적인 영화이다. 쿠엔틴 타란티노 감독의 입문작으로 매우매우 추천하고 싶다! 1500피스짜리 시간의 퍼즐을 흥명나게 끼워 맞춘다. 여러 정신없는 이야기가 한데 모여 나를 휘잡아버린 영화 쿠엔틴 타란티노가 장르다 존트라볼타와 여배우의 트위스트 춤과 강렬한 붉은색이 많이 나왔던 강렬한 영화로 기억 다큐같은 느낌의 그시절 유행했던 스타일의 영화 손때 묻고 자극적인 잡지에 제일 먼저 손이 가는 이유 여기가 영화가 다른 서사 예술과 차별되는 지점이다. ㅋㅋㅋㅋㅋㅋ이야기가 산으로간닼ㅋㅋㅋ 국외자들 뇌비우고 봄 진짜 잘 만든 싸구려 영화 총, 돈, 살인… 단발 머리 여자!!! 워낙에 말이 많은 친구라 만나면 정신 없을거 뻔히 알면서도 왠지 모르게 매번 궁금해서 만나러 가게 되는구나!🤣 지금시점에 봐도 이렇게 재밌는데 저당시에 저걸봤다면 한국의 휴대폰이 제대로 있지도 않을때 봤다면 충격이였을듯 시간 순서를 뒤죽박죽 섞어 놓은 독특한 구성. 각기 다른 개성을 가진 캐릭터들. 애슐리나 쿠우쿠우 같은 영화 제목에 충실하네 총알로 완성된 신앙심 뒤죽박죽 섞어 만든 이 오묘하게 재밌는 플롯이 정말 무릎을 탁 치게 만드네 파멸과 구원의 교차로를 타란티노식의 짜릿한 연출로 안내해준다. 어지러운 장면의 흐름을 잘 이끌어가는 대사와 연출의 힘이 대단하다 타란티노만이 만들 수 있는 “값싼 명품” 스토리 - ★★★★ 연기력 - ★★★★ 몰입도 - ★★★ 감상 후 유튜브로 관련 영상 보면 더 재밌음 극도로 폭력적이면서 유머 넘치며 미친 연출력. 이 영화는 몇번이든 볼듯"
날씨의 아이,"어쩌면 더 나아질 신카이 마코토의 미래를 옹호하며, 오타쿠를 위한 로리타 코드만 어찌한다면 다음 작품을 기대할 수 있을 텐데 영상 - 맑음 그 외 - 폭우 언제나처럼 예쁜 도화지에 원래 그리던 소년 소녀 한 쌍을 담았네 마흔 여섯의 중년은 아직도 여자 가슴을 보고픈 소년의 마음에 그저 달아나고픈 열여섯 사춘기에 어른들은 이해 못한... 대의보다 소중한 내 눈앞의 사랑 지루하게 내리는 비 마저도 아름답게 만드는 재주. 전작의 반복과 변주 사이 다시봐도개띵작30번봄 ㅋㅋ 푸른 하늘, 맑은 날씨보다 더 값진 너라는 존재 지루하듯 흘러가는 소년 소녀의 비기와 사라진 개연성, 끝을 향해 치솟는 사랑이 추락 속에 찬란한 빛으로 뒤바뀌며. 역시 신카이! 잠겨도 좋을 그 사랑의 날씨는 맑음 내용도 괜찮았고 그림의 색감이 너무 좋았다. 일본 만화를 좋아하는 사람은 봤겠지만 추천해본다. 이 영화는 여러번 봐도 재미있게 시청한거 같다. 마코토 3부작중엔 최하 색감이 좋다 스즈메와 마찬가지로 약간은 아쉬운 작품. 너의 이름은 이후로 기대를 너무 많이 해서일까. 재밌어요 허술하지만 짙은 여운 오늘 개봉하는 영화 날씨의 아이를 월요일 메가박스 시사회로 먼저 접하고 왔습니다. <너의 이름은.>의 신카이 마코토 감독의 신작인데요. 3D 애니메이션이 난무하는 요즘 역시 셀 애... 아름답고 사랑스러운, 또 보고 싶은 너의 하늘의 날씨는. 당연을 희생을 하지 안함으로 큰 여운을 줌 다만 다른 사람이 보기에는 스토리가 아쉬울수도 있다. 아름답고 섬세한 영상미라는 자신의 강점을 빼고는 참 많은 것이 후퇴한, 신카이 마코토의 아쉬운 제자리걸음이다. 최악 작화와 음악으로 묻혀가기에는 너무나 크게 느껴지는 여러 공백이 아쉽다. 잔잔한데 오히려 더 생각나는. 후반부가 ㄹㅇ god 너의 이름은 에 비해 한참 못미치는 작품 맑고 푸르던 작품 끝에 혼란스러운 폭우가 내렸다. 일본애니매이션 동감하기 어려워진짜로 3부작 다 늘 먹던맛이긴 했지만. 1-3-2 순서로 보게됐는데, 이게 좀 현실적으로 처절해서 오히려 1-3-2 순서로 보는게 맞는 것 같은 기분이 들었다. 내 사랑을 위해 우리의 우정을 위해 경찰이 제일 불쌍한 판타지라니. 세상에나 별로 그럼에도 불구하고, 소년은 청년이 되었다. 신카이 마코토 재난 3부작 중 최애 아름다운 영상만큼이나 순수하고 예쁜 사랑이야기 작화와 음악활용력은 정상급 작화와 작법이 이리 차이나다니 세상을 위해서가 아닌 우리를 위해서 살자 ""이 세상은 처음부터 미쳐있었어. 그러니 너의 탓이 아니야. 오만하기는"" 나만이 무너져야한다고 믿는 기운 잃은 아이들에게.. 210413 작화는 좋은데 지루하고 몰입이 안된다 전체를 위한 개인의 희생이 타당하지 않다는 주장에 필요한 근거는 없고 불필요한 여성혐오적 묘사가 있을 뿐 아름다운 작화와 음악을 즐기는 묘미. 실사 영화와 애니메이션의 차이를 느낄수 있다. 작화의 끝을 보여줌 와우 주인공이 아무리 미성년자라고 해도… 이 영화 본 이후 내 기분 고기압 맥빠진다 작화랑 ost만 남겼다"
