titles,reviews
존 오브 인터레스트,"보여주지 않고도 다 보여주는 섬뜩한 실화. #🌺 모든게 계획대로 되돌아가던 와중에, 문득 헛구역질이 올라온 이유는. 존 오브 인터레스트 담 너머로 들려오는 총성과 비명소리는 영원히 날 괴롭힐 것. 실화라니 믿을수없다 우리의 낙원은 무관심이라는 담장 안에서 지어진다 작품의 의도와 사운드는 알겠지만 너어어어어어무 지루했다 홀로코스트에 대한 가장 도발적인 영화 아름다운 시각, 잔혹한 청각, 역겨운 육체. 모든 장면에 아우슈비츠 모습이 상상된다. 소리에 집중해야 해요. 시작부터 마지막 엔딩크레딧까지 소리가 중요해요. 끝나고 해석 찾아보면 더 좋아요. 자막이 다른 영화보다 작아서 극장에서 볼땐 가까이서 보는게 좋아요. 시각적, 청각적 정보 제시를 통한 간접적인 묘사로 악의 평범성을 드러내는 좋은 영화이지만...이를 풀어내는 방식이 지루하다 눈앞에서 치워둔 잔혹함이란 얼마나 외면하기 쉬운가 차별이든 환경파괴든 전쟁이든 그저 내 알고리즘에 코박고 사는 요즘 세상과 뼛가루로 꽃을 키워낸 그들의 정원이 뭐가 다를까 잔혹한 것들이 자연스런 일상이 되고. 아름다운 것을 보여주지만 그렇지 못한 소리를 들려주고 전달한다. 사운드, 대사, 화면 하나라도 놓치지 말것! 잔인한 장면 없이 소름돋는 영화! 그러나 좋은 영화라고 다 재밌지는 않은 법!!! 평생 엔딩크레딧 곡과 같은 그들의 비명과 아무것도 쏟아낼 수 없는 지독한 헛구역질의 반복 속에서 나른한 일상을 보내며 구원 불가능할 너의 악의 평범성을 입증하길 바라. 의미없는 장면들의 연속 이런걸 영화라고 부를수 있을까? 사운드와 절제된 연출을 통해, 잔인한 역사를 오히려 더 깊이 느끼게 한다 너무 쫀쫀하고 딱딱해서 씹다 씹다 헛구역질 난다. 끝 10분이 압권. 인간 말종에 대한 현란한 탐구의 극명한 사례. 조나단 글레이저. 2023. 4.0 눈과 귀를 막는다면 당신도 악인이 될 수 있다. 벽을 둔다, 영화를 보는 우리도 마찬가지 그들만의 낙원. 눈과 귀만 막으면 없는 것이 되는 것인가. 우리는 사회에 대해 무관심인가 혹은 무지한가. 누군가에겐, 떠나고 싶지 않은 낙원. 담장 너머 누군가에겐, 차라리 미치는게 나을 지옥. 분명 보지 않았는데, 선명하게 보인 끔찍함. 역사 비극의 창백한 담시. 영화는 이렇게 또 한걸음 진보하는 듯. 올해 본 영화 중에 제일 역겨운 공포 영화 보이지 않는 다고 해서 볼 수 없는게 아니다 하지 않았다 해서 안한게 아니다 눈에 보여지는 천국 귀로 들려오는 지옥 아름다운 산수 속 괴로운 아우성이라는 괴리 악이 평범해지면 사회가 악에 무뎌져가지만, 사람의 내면엔 악을 토해내고자하는 본능적 관성이 있기에. 180° 밖 가장 높은 장벽과 가장 어두운 심연. 평온한 이미지와 섬뜩한 사운드를 교차하여 무심한 악행의 극단을 응시하다. 평범한 어느 가족의 이야기. 그리고..... 모두에게 평등한 색조차 얻지못한 담장 밖의 어느 누군가. 무채색이 되어야 그곳을 벗어날 수 있는 ‘그소리’의 주인공들의 이야기 악은 평화롭고 권력자는 우아하다. 선은 치열하고 약자는 절박하다. 그리고 악은 지루하다. 영화 형식의 전시 예술을 본 것 같은 재해로 세탁되어 풍경으로 건조되는 가해 내 인생 잘 살고 싶다는 마음에서 비롯된 헛구역질 나는 합리화 보이지 않는 악의 소리에 치솟는 역겨움을 부여잡고(4.0) 과거의 보고 듣지 못하는 것, 현재를 듣고 보지 않는 것 그곳에는 꽃과 음악, 그리고 어둠만이 있었다. 아니, 지금도 여전히 이곳에. 보이는 것 만이 모든것이 아닐 때, 들리는 것도 유심히 듣고 들어야 보이는 구박과 살상의 현장 미지와 모호는 예술의 가장 큰 축. 일상의 벽을 넘어 넘실거리는 그 거북한 공기. 영화는 너무나도 평온하지만 나는 너무나도 끔찍한 전쟁의 소리를 보았다. 잊지 않겠다는 절규가 내 고막을 찢을 때 울타리 안에서 지켜본 세상에서 가장 잔인한 세계 잔인한 연출 하나 없이 무섭게 느껴지기란 어려운데, 이 영화가 그걸 해냄.. 들리지 않는 비명, 보이지 않는 공포 B 잔인한 장면 없이 잔인한 믿고 보는 칸 심사위원작.. 그 와중에 조나단 글레이저의 10년만의 신작이라니?! 잊지 말아야 할 것. ."
지시결혼적관계,"유치하고 역대급 항마력 필요한 드라마지만 이전에 본 니급아적희환 둘 케미가 너무 좋아서 계속 보게됐어요 왕옥문 왕자기 케미 굿.. 유쾌한 로맨틱 코메디 이 드라마를 보려고 한 게 아니라 니급아적희환 때문에 왕자기-왕옥문을 보려고 한 것. 그것만 보면 됨. 유치해 유치해 꽉 막힌 해피엔딩 클리셰 범벅....재밌다.. 시간있을때 가볍게 볼만한 로맨스 드라마 유치하지만 사랑스러운, 왕자기 왕옥문과 사랑에 빠질 수 밖에 없는 드라마. 조심스레 장담해보는데 드라마 속 절대 이혼 안할 것 같은 커플. 다만 서브커플 노잼 주의. 가볍게 보기"
화양연화,"만남에 끝이 있을 것은 알았지만 마음이 이토록 오래 머물줄은 미처 몰랐지. 가끔씩 특별한 걸 하지않아도 심장을 훑고 지나가는 작품이 있는데 이 영화가 그렇다 호텔에서 려진을 기다리다가 벨이 울리자 아주 잠깐 입꼬리가 올라가던 모운의 표정이 잊혀지지 않는다 화양연화 외설적인 장면이 없음에도 불구하고 섹시한 작품이다. 짧은 순간이 가져다주는 긴 여운을 계속 되뇌이다. 어른들은 다 명작이라는데.. 난 모르겠다. 술을 처음 먹을 때는 왜 먹는지 모르는 것처럼 이 영화는 나에겐 아직인 것 같다. 화양연화가 화양연화했다. 뿌연 창문 너머로 본 그때의 우리는 첫 만남부터 생생하게 숨막힌다. 때때로 엇갈림은 사랑보다 아름답다. 화양연화:인생에서 가장 행복한 시기 분위기와 색감에 압도당하고 젊은시절 찬란했던 그들의 모습은 황홀하고 치명적이다.. 단 한 장면도 아름답지 않은 것이 없는 압도적인 미장셴이 모든 것에 설득력을 부여해낸다. 60년대 홍콩과 함께 사랑에 대한 아네모이아를 느끼게 해주는 영화 섬세한 미장센으로 영화사를 수놓은 왕가위 감독의 걸작 몰랐다. 그들의 엇갈림조차 서로에 대한 사랑이었다는 것을. 인생의 가장 아름답고 찬란한 시절은 아무도 모르게 시작되었고, '화양연화' 나도 모르게 이 영화를 좋아하게 되었다. 어떤 영화는 사람을 매혹한다. 왕가위 느낌의 정수 함께 지낸 시간이 서로의 인생에 있어서 가장 아름다운 시기로 기억될 것이다. 사랑이라는 선을 넘지 않았기에 비로소 화양연화로 일컫을 수 있게 됐다고 생각한다. 왕가위의 아름다운 불륜이란 이런것 진짜 그들 처럼 영화가 내 마음 속에 스며든다. 나도 모르게 시작되어 누구도 끝맺음 지을 수 없던. 중경삼림보다는 감흥이 덜했지만, 그럼에도 직관적이고 마술적인 장면들. 왕가위는 거울 장인. 분위기, OST, 스토리 모두 완벽. 분명 불륜인데 마음이 먹먹해지는 사랑. 배우자들도 바람났는데 이들이 사랑에 빠지면 안 될 이유는 없다. 다만 사랑이 아니어야 할 사랑일 뿐. 불이 있어도 마셔야 불이 붙는 담배같은 사랑, 말 없이 우아했던 아지랑이만 그립게 사랑할 수 없기에, 사랑할 수 있는 순간들이 인생에서 가장 아름다웠다. 아름답다. 미장센. 그리고 사랑. 유명한 것엔 이유가 있는 법... 이 좋은 걸 지금 처음 봤다는 게 이해되지 않는다. 내년 겨울이 되면 다시 생각날 듯 왕가위 감독 특유의 미장셴 돋보이는 불륜을 힙하게 만든 영화. 최애 영화 그들은 처음부터 사랑했다. 이유가 없는 사랑이었다. 제대로 시작하지못한것은, 제대로 끝맺지못한다 뭔 내용인지 파악이 안돼요 틈만 나면 무드 있는 척 브금 쫘악 들어가서 머릿속엔 물음표만 가득 . 끝내 맞닿지 못한 심장 소리 눈이 맞은 그 순간부터 우연아닌 필연으로 홀로 있는 것을 이렇게 이쁘게 담을까 불현듯 엄습하는 농밀한 감정 아름다운 영상미와 절절하게 다가오는 사랑 왕가위와 양조위 2024/9/4 cgv/재관람 음악이 흐를 때마다 더 가까워진 서로의 심장 소리. 하지만 이별했기에 더 바랜 추억이 되었다. 사랑, 그 미묘한 분위기를 스크린에 담아내다. 사실 보면서 감정선 이해를 잘 못했다 그래서 보면서 졸았다 나중에 나이들어서 보면 이해가 될지 모르겠다 나의 아름다움에 대한 기준이 의심스러워지는 수많은 평가들 인생에 어떤 시간은 그렇게 특별하게 느껴지는 때가 있다는 것을, 영화가 시간의 예술이라는걸 새삼 실감하게 해주는 영화. 영상미와 분위기가 압도한다. 명작이라고 불리는 것들은 다 이유가 있다. 왕가위 감독 특유의 감각적인 영상미와 세련된 연출이 돋보이는 작품. 몽환적 분위기, 섬세한 카메라 워크, 강렬한 색감 등이 어우러져 1960년대 홍콩의 분위기를 효과적으로 전달한다 붉은색 사랑은 그 분위기만으로도 찬란하던 그 시절이여 닿을 듯 말 듯 닿지 않는 애절한, 다시 만날 수 없는 끝사랑을 예술적 샷으로 담아냈다"
약사의 혼잣말,"남여 모두 재밌게 볼 순정 추리 중국풍 애니 약사가 주인공인 추리물. 짧은 에피소드 한두편에서 사건을 해결한다. 신분의 제약으로 코난처럼 뒤에서 돕는 역활을 한다. 각 편이 흥미진진하다. 한드처럼 출생의 비밀도 있다 헐! 첫화에 나온 호기심과 지식욕, 약간의 정의감이라는 주인공의 성향이 꽤나 마음에 들었던 장면 :) 작화의 퀄리티가 높고 전반적으로 가볍게 보기 좋은 추리장르. 생각없이 봤는데 꽤 재밌네요 그리고 가끔씩 나오는 SD 작화가 넘 귀여워요 궁중 암투를 흥미롭게 추리하고 풀어나간다. 설정이 탄탄한 원작을 잘 재현하고 유우키 아오이의 여주 연기가 탁월하다. 흔히 보지 못한 배경에 컨셉... 여주도 등장인물들도 좋고 스토리도 좋아요 짱 유치해보이지만 생각보다 따뜻한 전개 ㅋㅋ 여주 목소리 특이함 일본인들이 만든 중국을 배경으로 한 애니라는게 독특한데, 나름 괜찮음. 기록용) 18화까지 봄 약사의 옷을 입은 사실상 탐정 마오마오의 추리 애니로 흥미로운 이야기 전개에 시즌2도 기대 그시대에 맞는 배경과 스토리가 돋보이는 작품 너무 사랑으로 치우쳐지지도 않고 줏대있는 주인공이 너무 귀엽다 :) 2기도 너무 궁금 2기 나온다고해서 봤는데 순식간에 봤네... 특별한 듯 단순한 의원의 궁중추리(3.0) 독도 씹어먹는 여주라니 매력적이다. 너무 똑똑해도 너무 몰라도 안돼는 살얼음판 궁에서 적당히 선을 넘나들며 잘 살아가는 마오마오가 멋지다 (약초에는 눈이 돌지만ㅋㅋ) 약사의 혼자말이라 쓰고 소녀 김전일이라고 읽는다. 뭐든 다 아는 애가 자기일만은 영 모름.. 그래도 볼만했다. 시즌2 주세요 제발제발제발 마요마요는 이쁘다. 사건해결하는 능력이 있는 아이.지켜보는 재미가있다. 계속 보게되는 스토리 간만에 빈틈없고 구조가 탄탄한 드라마를 본 듯 하다 궁중을 소재로한 추리극은 정말 색다르면서도 재미있네요. 십이국기부터 사극까지 역사극을 좋아하는 것도 이 작품을 좋아하게 된 게기였겠지만 그보다 캐릭터의 입체감이 너무 좋네요. 약학과 눈썰미로 풀어내는 추리가 꿀잼 일본 애니메이션인데 중국풍 이야기 인게 신기해서 봤는데 벌써 정주행 4번은 한 것 같다. 유우키 아오이님의 매력과 마오마오의 매력이 합쳐져 완벽한 상승효과가 일어났다! 스토리의 개연성이 탄탄하지 못하다는 느낌을 내내 받는다. 현실적인 궁중암투와 섬세한 심리묘사를 기대한다면 적절치 못한 작품. 비슷한 소재를 다룬 대장금에 비해 많이 아쉬움. 주인공들이 귀엽다가도 진지하게 사건을 해결해 나갈 때 재미있었다. 장면 하나하나 놓칠 부분 없이 재미있고 작화도 예뻐서 눈이 즐겁게 시청했다. 약간 대장금 느낌임 넘재밌게봤음 재미있어요! 2023. 10. 22. ~ 2024. 3. 24. SD 귀여움 가오슌조타 추리물 좋아하는 사람은 좋아할 것 같다 나는 좋았다 대륙의 후궁 생활을 약사 마오마오를 통해서 보여줍니다. 평범하지만, 독과 약에 대해서는 비범한 마오마오가 그녀의 의지와는 상관없이 황궁의 중심으로 들어가게 되는 이야기입니다. 잔잔한 분위기와 추리를 좋아한다면 봐야하는 만화. 추리의 내용이 생각보다 전문적이여서 몰입이 좋다 주인공이 똑똑한것 같긴한데 그 머리를 써먹지를 않고 난 다 알고 있지만 당해준다는 식으로 진행하니까 좀 답답해서 하차했어요... 이거 왜 안 봐요? 제발 봐요. 너무 재미쎠 혼잣말을 꼭 봐야할까 대장금과 일본감성을 섞어서 중국배경으로 한 애니 그냥 주욱 보기 부담없고 여주는 귀엽고 당차서 좋다."
매드 맥스: 분노의 도로,"샤를리즈 테론 너무 멋있다. 미친듯한 전율이 느껴지는 영화 끝도 없이 달려 절망의 땅에서 찾는 구원. 기타리스트에게 멋진 기타와 단독적이고 이동가능한 세션을 지원 할 줄 아는 임모탄 님이야말로 진정 음악을 사랑하고 아티스트를 아끼는 훌륭한 지도자 이십니다. 무!조!건! 극장에서 체험해야 하는 영화!!!!! 어떻게 이런 스토리를 만들었을까 도파민 중독자가 만든 2시간 도파민을 끊임없이 공급해준다. 어느 누가 이런 액션물에 스토리가 많이 부족하다고 하는가…그 자 앞에 <매드맥스: 분노의 도로>를 보여줘라. 그 입 디물라 진정한 MAD MOVIE 분노가 메마른 대지를 적실 때 강렬한 잔상이 뇌리에 피어나다. 장면장면이 예술이에요. 극강의 화면몰입도. 너무 판타스틱 희망을 좇아 미친듯이 솓구치는 아드레날린 말이 안나오는 액션에다 철학까지 있다. 연출과 액션의 황홀한 감동 그 장면이 cg가 아니라니 진짜 미친 영화 소문난 집이 입맛에 맞지 않았다 화면을 횡적으로 미친듯이 가로지르는 속도감과 견줄 세로의 장대 액션. 포스트 아포칼립스를 다룬만큼 세기말적 이미지를 각인시키려한 분장과 연기들이 압권이다. CG를 쓰지 않아 중력에... 무조건극장에서봐야하는영화…. 엔진소리가 내 심장소리같다 ◈ 끈적한 지루함 따위, 8기통을 통해 가열되고... 결국, 주체 못할 속도감과 함께 기체가 되어, 증발해 버린지 오래. 니콜라스 홀트의 한 때 팬으로 빡빡이에 은니 스프레이는 너무나 강렬하다 씨앗과 여지들 모두 인상깊었던 영화 박진감 넘치는 영화로는 최고입니다 조지 밀러 감독의 연출도 미쳤고 톰 하디, 샤를리즈 테론 포함 배우들의 연기도 미쳤다 그냥 '매드맥스 분노의 도로' 영화 자체가 미쳤다 핵전쟁으로 멸망한 22세기 곧 올지도?! 다른분 기타리스트 드립땜에 아무 생각이 안드네 ㅋㅋㅋ 아놔 인류가 지성을 상실한 미래를 상상해본다면 매드맥스 극장에서 관람하지 못한 것이 천추의 한 황량한 사막에서 북소리가 들리는 순간 내 심장도 미친듯이 울린다. 그들은 물건이 아니다. 우리도 물건이 아니다. 의미없는 카트라이더 영화를 좋아하는 사람에게는 역대 다섯 손가락 안에 드는 액션 무비 피먼지와 황량한 사막 속에도 구원은 존재한다 심야영화로 보고 친구랑 집에 걸어오는 내내 여운이 가지 않아 얼빠져서 집에 왔던 기억이..... 진짜 강추 말 그대로 미친 영화.. 아날로그의 끝판 왕.. 앞으로 이런 영화 볼 수 있을런지.. - 야만인들의 지배에서 벗어나 어릴적 푸른 고향으로 돌아왔지만 푸르던 곳은 메말라버린지 오래. 160일 바이크로 달려서 사막을 건너려했지만 차라리 본거지를 점령하는게 낫겠다는 판단, “그 얼마나 오랜 시간을 허접한 액션에서 서성거렸나” 아날로그 액션에서 느낄 수 있는 말초적 쾌감. 탄탄한 플롯에서 오는 지적 충격이라는 상반된 매력을 고루 갖춘 21세기 최고의... 생각을 하고 볼 필요가 없다. 등장인물의 갖가지 사연을 넣었다면, 이 영화의 평점은 훅 떨어졌다. 액션에 CG가 판치는 시대에 미친 SF 액션 영화가 강림했다. CG만 떡칠하는 너... 모든 장면에서 에너지가 넘치고, 직선적이지만 압도되어 지루할 틈 조차 없었다. 함께 미쳐야 진정한 재미를 느낄 수 있는 작품. 미쳐야 산다! 말 그대로 압도당한다. 무조건 극장에서 봐야 할 영화 처음으로 내게 액션영화의 희열을 알려준 영화 음악연출 너무 좋고 워보이 개좋음 톰하디는 말할것도 없고 자동차 액션만으로도 눈을 사로잡는다. 이게 카체이싱이다. 기승전결이 완벽했다. 첫 매드맥스가 보고싶어지는 영화 순수재미에 살짝 곁들어진 메세지 2015년에 본 영화 중에 제일 재밌었다 2시간짜리 도파민 주사 맞은 듯한 느낌 모두 다 같이 여덟 손가락 깍지 끼고 V자 만들어 하늘 위로! 헉헉 존잼 보세요. 미쳤다 전율,몰입,개성,음악,연출력,연기 다 갖춘 영화 같이 미쳐가는 재미가 있다 ."
원경,"출연자가 노출 수위를 대본이 아니라 촬영 직전 콘티로 알게 되는 콘텐트는 제작돼서도 공개돼서도 안 된다고 생각합니다만? 게다가 대역에 배우 얼굴 합성이라니 기괴하기 그지없음. 티빙아 정신차려라....몸으로 관심끄는 시대는 끝났어 생각보다 시대극이랑 차주영 배우님 비주얼이 잘어울리네요 고구마가 예상되지만 재밌을 것 같습니다,,,! 여성주의를 설파하기 위해 이런 정도의 댓가를 치뤄야할까? 역사왜곡의 악취가 가득한 드라마. 암담하다 뭔데 왜 재밌는데 ㅋㅋㅋ 사극을 좋아하지않는데 한번보고 푹빠짐 재밌어요 3화 빨리보고싶어요 하필 오픈 시점 시국 영향에 악플이 생성되겠지만... 극중의 원경은 사악하지도 멍청하지도 않다. 드라마 오픈 시점, 이 드라마보다 나은 드라마가 없는데? 드라마 최대의 빌런은 채영 태종은 처가에 대한 자격지심에 왕비에게조차 적대감을 들어내는 발암캐릭으로 나온다. 냉대속에서 세종을 길러내는 원경. 이건 입지적 이야기가 아니라 인간의 고뇌에 관한 고찰이다. 웃기네.. 원경이 대사 하는거 들어보면 지금 패미들이 외치는 당당한 여성 그 자체던데?? 그러면서 벗기면 남자들이 조아라 할것 같든?? 그냥 짜증나던데.. 니들 사상 원경왕후의 다음이 기대된다! 된다!! 차주영!!! 힘!!!! 아쉽게도 제 취향은 아닙니다… 스토리가 너무 진부해요 19금만 포커스 된 삼류 사극 노출씬 때문에 여주 캐스팅 된게 확연히 티 나네 김건희가 드라마 만들라고 하드나 ? 차주영 중전역에 너무 잘 어울리지만 대본 좀 너무함 출연자들의 연기는 나무랄때가 없으나 개연성이 부족한게 단점이다.(예를들면 방원의 갑작스런 감정변화등) 다 떠나서 내용이 너무 피로하다 현실만 해도 넘치게 피곤한데 개존잼 예전처럼 100부작 대하드라마로 제작해달라!!!! 한국판 튜더스ㅡ 재미있다 마네, 뭔가 더 봐야하나 하는 의구심이 생겨서 3화 보다 하차함. 이현욱배우의 어쩜 그리 나쁜역할을 잘하는지ㅋ 이방원역할도 딱인듯합니다 노출 신 없어도 될것같은데... 배우들 연기 잘하고 재미있어요 역하다 2025년에도 삼류노출씬을 넣는 감독이니 제작사니 에휴 진짜 개꿀잼입니당.. 혜정이랑 시아형 너무 예쁨 권력싸움.... 앞으로가 궁금해지네요 파워파워 차주영님 연기 기대가 됩니다 이럴거면 그냥 가상의 설정이라고 해라... 후궁들이 연기를 너무 못하고 채령이가 저렇게 변하게 된 개연성이 납득이 되지 않음;"
