titles,reviews
박쥐,"아우 너무 어린나이에봤나 충격적인 영화였다. 욕망에 대해 어리석음이 보였던 영화로 충분히 자극적이었고 영화스토리에 대한 나의 생각들이 많이 충돌하는 영화였던거같다. 배우들연기는최고 가장 드러낼 수 없는 욕구를 채워야만 하는 성직자. 소재가 넘 신선했고 역시 연출과 미술 보는 재미가 훌륭했다 이 모든걸 한 영화에 담으려는 욕심을 부리고도 조화를 이뤘다. 카메라의 움직임 한 컷에도 수백번 고민했을, 단연 박찬욱 감독의 최고작. 대사 한 마디 장면 하나하나가 소름끼친다 감독마다 같은 배우여도 이렇게 다른 모습을 끌어낼 수 있구나 신기했던 작품입니다. 다소 서늘한 분위기고 호불호가 갈릴 듯 합니다. 취향에 맞지 않는 사람은 그저 역겨움, 역겨움, 역겨움의 연속. 박찬욱 감독 영화 박쥐. 후기 리뷰. 욕망 그 자체. 진짜 보는 내가 같이 미칠 것 같다. 혐오스런 인간다운 모습들. 그런게 인간답다고 주장하는 작위적인 변태성이 매력이다. 신선하면서도 기괴한 영화. 박찬욱 감독의 묘한 매력은 정말 알 수 없다. 하지만 확실한 것은, 그는 변태라는 것이다. ’아름다운’이라는 수식어가 붙는. 사람들은 왜 금단의 열매를 탐할까 독특한 소재라서 좋았고 특유의 분위기가 인상적이었음 김옥빈을 다시 보게 해준 영화 '집이 아작이 났는데 마작이 하고 싶니?' 이런 개그가 너무 좋다 ㅋㅋㅋㅋㅋ 코드만 잘 맞으면 정말 재밌게 볼 수 있는 영화 인간의 욕망의 타락과 끝없는 굴래 속으로 비위 상하고 흥미롭고 비위 상해... 박찬욱 영화 중에 제일 변태적 내 갈증을 채워주는 아름다운 영화 박찬욱, 그의 최고작 별점이 생각보다 매우 낮기 때문에 고개를 갸우뚱 할 수도 있지만, 먼저 말하자면 <박쥐>는 박찬욱 감독 영화중 세 손가락 안에 드는 수작이라고 생각한다. 영화 군데군데서 찾... 손대면 안되는 줄 아는 금단의 열매인데, 자꾸만 손이 가는 걸. 진부한 소재를 이런 식으로 변주하여 연출한 박찬욱 감독에 그저 감탄만. 처음에는 젊고 예쁜 김옥빈의 노출연기에 거부감이 들었었는데 후반부 뱀파이어 연기는 진짜 뱀파이어 그자체였다. 호불호 갈리는 영화겠지만 김옥빈 연기에 소름이 돋았음. 대단한 영화. 우리나라에선 박찬욱 감독말고는 이런 영화를 만들 수 없을 듯 하다. 거대 자본을 끌어들여 이런 도발적인 소재를 찍을 수 있다니... 박찬욱 감독 특유의 미장센과 스타일이 살아있다. 해가 져야 살 수 있는 존재들의 칸타타 미친 박찬욱 감독과 송강호 배우의 좋았던 호흡이 살아있던 시절의 상당히 호평을 받았단 영화지만 이해하기 어려웠던 내용과 메시지는 일바대중들이 알고 봤을까 싶었다 인간을 되짚다 한국에서 이런 이야기를 할 수 있는 감독은 누구? ONLY 박찬욱 박쥐 신선한 각본, 씬들 하나하나에 너무 힘이 실리는 느낌 !!! 조선 스타일리쉬의 정수 넷플릭스판보다는 왓챠판이 더 친절함 짐승의 욕망을 거리낌없이 드러내면서 회개와 도덕이라는 이름하에 인간성을 지키려고하는 코미디. 그걸 즐기고 있는 내 모습에 밀려오는 수치심으로 완성되는 나만의 <박쥐> 인간의 괴리가 무엇인가? 물음을 던지는 작품. 콧대높은 연출력과 미장셴은 당대보다 박찬욱 사후에 더 높게 평가될 작품으로 만들었다 라여사의 연기는 놀라움의 연속이었음… 김옥빈보다도 요염하고 섹시했던 흡혈귀 송강호 박쥐 그 당시에도 인기가 많았던 영화 인간의 가장 강렬한 감정인 욕망과 사랑을 가장 강렬한 영화로 보여준다. 박찬욱 스타일의 최절정 아닌가. . 인간은 누구나 욕망을 가지고 있다는 것을 잘 보여준다 매혹적이고 강한 김옥빈 또 보고싶다 영화 언제나오나 익숙한 장르적인 소재와 에로틱하지 않은 한국적 재료로 만들어낸 가장 관능적인 장르 영화. 박찬욱의 독특한 영화 세계. 너무나 완벽한 송강호의 캐릭터 소화 과잉? 뒤죽박죽? 그조차도 매력으로 만드는 거장의 품격 중반까지 너무 지루하고 불쾌한 장면이 가득하지만 후반으로 갈수록 박찬욱의 테이스트를 한껏 맛볼 수 있었다. 박찬욱 감독의 한계는 어디일까. 욕망이란.. 가장 기억에 남는건 박찬욱 감독 특유의 미장센. 헤어질 결심은 절제됨을 박쥐는 노골적인 욕망을 본 느낌 피와 욕망의 범벅 사이에서도 아름다웠던 두 뱀파이어의 로맨스 갈증의 전율, 소멸의 아름다움, 도덕의 딜레마, 사랑의 처절함."
콩콩밥밥,"예고편부터빵터짐 진심빡치는경수 ㅋㅋㅋ광수잡는경수빨리보고싶어요 콩닥콩닥! 콩콩밥밥! 네 밤만 자면 됩니다 여러부운~ 콩닥콩닥! 콩콩밥밥! 경수 광수 케미 빨리 보고싶어요👍🏻🫶🏻 콩콩팥팥에 이어 또 얼마나 재밌을지 궁금해요! 이번주 목요일 8:40분에 티비엔에서 본방한다는데 얼른 보고 싶어요!! 두근두근 출연진부터 이미 재미 보장이네요 경수광수브라더스 조합은 완전 인정이죠!!! 너무기대됩니다♡ 예고부터 케미 기대돼요 소소한 재미에 따뜻함이 곁들여졌다. 다시금 떠오르게 되는 구내식당의 소중함. 경수가 만든 음식들을 집에서 한번 만들어서 먹어 봤는데 너무 맛있다.. 👍👍 요리까지 잘하는 경수! 😊 콩콩밥밥 최고!✨️✨️🩵 웃겨요~~ 1화 재밌더라구요 ㅋㅋㅋ 믿고보는 이광수님과 도경수님의 케미 광수와 경수가 만들어낸 부엌 <광&경>, 토닥토닥 절도있는 칼질 소리에 이 내 두 발 리듬따라 들썩이니라 우당탕탕 들려오는 **소리에 이 내 마음 조마조마 금치못하네. 광수와 경수의 조합만으로도 너무 기대됩니다 광수와 경수의 케미를 다시 볼 수 있다니 너무 행복합니당 그냥웃김 밥친구로 딱임 둘케미 기대가 됨ㅎㅎㅎ 도경수 칼질 와 대박 잘함 뭔가 이광수 캐릭터는 인위적으로 사고를 치려고 하는 느낌이라,, 조금 부담스러운 느낌,,, 그냥 전 그랬네요, 칼질이 워후.. 0회 뜬거 봤는데 일 벌리는 광수와 수습하는 경수. 톰과 제리 케미 벌써부터 우낍니다 ㅋㅋ 재미있을 거 같아요 예고편부터 너무 기대되고 9일만 기다리는중.....🥺"
존 윅 4,"존 윅의 총보다 무서운 윈스턴의 세 치 혀. 존 윅 다정한 살인자여 영원하소서. 그리고.. R.I.P. 샤론 랜스 레드 딕. 시리즈의 완벽한 종합 존윅의 지독한 개사랑❤️ 슈퍼히어로 영화들이 몰락하려는 순간, 블록버스터 지평선 위에 떠오른 것은 이순신의 정신과 함께하는 사무라이 서부극이었다. 존윅이 이제는 액션을 그만할때가 되었나? 액션이 볼만 한데 하면서 힘들어보인다. 그리고 액션만을 기대하고 3시간은 넘 긴거 같다. 존윅 4의 액션이 정말 대단한 이유 싸우는 장면이 전부 다 클라이막스라서 3시간 내내 눈을 뗄 수가 없다. 3시간이 짧게 느껴질 정도로 꽉 차있어서 재미있게 보았지만 자토이치식 맹인 검사 설정이 너무 싫어서 견딜 수가 없다 역시나 기대 이상의 액션 후반부 장면은 존윅시리즈중 최고의 명장면 다만 초중반 부분에는 약간 루즈함 1편의 예상치 못한 인기로 진작 컨셉에 잡아먹혔음에도 기어이 마지막 챕터까지 걸어온 존 윅 아저씨. 매번 투덜대면서도 4편 다 보고 전부 빨간불 주는 나도 좀 이상하긴 해... 액션이라는 장르를 정의한다. 장르의 쾌감을 예술의 경지에까지 끌어올린 극단의 엔터테인. 존 윅이라는 캐릭터에 대한 완벽한 헌사이자 대범한 마무리. 끈덕진 피로와 쾌감의 여로, 그 황홀한 동시다발 그저 완벽하다는 말밖에 할 수 없는 시리즈의 최고작. 전작들의 단점은 없애고, 장점은 극대화하였다. 도로 한 가운데, 성당 계단, 오사카 호텔 등 기대 이상의 액션들을 보여준다 (세상에서 가장 무서운 딩동! 소리를 들었다) <존 윅>은 그냥 장르다. 끊임없는 액션, 카운팅하다 지치는 킬넘버링. 그야말로 '샷 앤 슬래시 액션' 의 독보적 프렌차이즈이자 정점 드디어 해방~~~~ 존 이제 좀 쉴수 있겠지? (는페이크) 액션영화의 마스터피스 존윅의 액션신은 새 영화가 나올수록 업그레이드 된다!! 현대 액션의 총집합체. 보고싶은거 확실히 다 보여주고 끝낸다. 무엇을 기대했는가? 액션씬이 피로했던 3편과 달리, 이번에는 존 윅 액션의 절정을 보여준 것 같다. 전반부는 전작들의 반복이였다. 하지만 후반 액션이 시작되고 감탄했다. 과하지만, 화려하게 불타는 마지막 불꽃. 모잠비크 드릴 플로우 비치 암 존 윅 통쾌한 액션 견자단의 활약도 볼 만 함 싸우고 싸우고 끝없이 싸우는 영화 마치 만화나 게임처럼 위에서 보여주는 방식은 신선하다 생각됨 존윅을 보고나서 액션을 보는 눈이 높아졌다 액션영화는 존윅이 최고다 별 하나는 러닝타임 때매 깎음 시리즈의 종착역다운 결말. 어김없이 화려하고 깔끔한 액션. 액션영화에서 스토리는 기대하면 안된다 액션과 간지의 끊이지 않는 협주곡. 군더더기 없이 길게, 확실하게 나가는 액션. 이런 영화를 바래왔다. 존윅 정말.. 착한 얼굴에 그렇지 못한 태도 마지막 40분 정도의 액션신들은 최고다. 제목을 쓸 시간에 한놈 더 죽는 영화 긴 여정을 보았다 <존 윅 4> 자유와 안식을 찾아 떠나는 마지막 여정 감각적 미장센과 다양한 상황에 연계된 액션의 포식 혹은 과식 존윅이 존윅했다.. 존멋 존잼. 한장르, 한스토리 안에서 더이상 새로울 게 없을 액션 영화인데, 기대 이상을 만족시켜 준 존윅4. 나 너 살아있는거 알고있다. 애견인은 기억할 것입니다, 윅의 총을(3.5) 쏘고 죽이는 놀이동산 서양 무협의 엔드게임 Yeah...가 그리워질듯. 1, 2, 3 봤으면 4도 꼭 봐야만... 관객들이 영화에 바란 액션과 영화가 관객들에게 보여주고자 한 액션이 궤를 같이 할 때 뇌절인걸 알면서도 의리때문에 보는 영화 시원한 액션, 앞만 보고 달리는 존 윅. 깊고 어두운 고난과 고통을 거쳐 다다르는 고단한 평안 시리즈 최고의 ""마스터 피스“ 아쌀하게 압살하다 흠..개그 액션 느낌이 중간중간 있다. 적이 많아지니 액션도 깔끔하지 않고..그냥 같은 내용이 3시간동안 반복되는 느낌 더욱 다채로워진 액션, 거대해진 세계관 위에서 노니는 존윅!"
다리미 패밀리,"3대 가족과 재혼으로 이루어진 가족의 구성원 들이 겪는 좌충우돌 블랙코미디. 매순간 연기력을 뽑내는 배유님들 대단합니다 매주 주말극 본방사수하게 만드는 다리미패밀리 화이팅 🥳 재밌네! 오랫만에 챙겨보게 되는 주말드라마 마음을 간질간질하게 만든다. 남주 캐릭터! 사랑스럽게 도른자! 캐릭터 하나 하나가 살아있음! 현재 10회까지 보고 확실히 알았다. 주드 미니 이런 구분은 무의미하다는걸! 대본 좋고 연기 잘하니 퀄리티가 굿! 오랜만에 보는 주말 드라마. 각자의 매력과 이야기를 가진 캐릭터 구성과 빠른 전개로 다음화가 궁금해지는 드라마입니다. 찌질해보이기도 하고, 깐족거리기도 하고, 웃겨보이기도 하는 최상호(신정윤) 전작 작품이 너무 진지해서 그런지 새로운 모습에 빠져들었다. 신정윤배우라서 가능했던 최상호! 오랜만에 본 주말 드라마. 재미나게 봄 사랑하는 마음으로 모든것을 헤치고 나아간다 오랜만에 챙겨본 주드 캐릭터들이 매력이 없고, 질질끄는 스토리에 급한 해피엔딩 마무리에 허무했다. 다림이 혼자 눈을 뜬것이 아니다. 공감한 모든 사람들에게 가족을 바라보는 마음의 눈을 뜨게 해줬다. 드라마틱한 에피소드를 찰떡같이 써먹고, 오랜만에 8시 주말극의 면을 세워줌. 일단 끝까지 봐야할것같다. 돈을 훔치고 훔치고 또 훔치는 도둑집안이라니 지금 답답함을 넘어서면 어떤 결론에 도달할까 역시 한국드라마의 한계인가"
구룡성채: 무법지대,"개봉전 무대인사 상영회로 만난 영화.. 홍콩 액션의 명맥은 이어간다는 느낌이 강했다 유치찬란 그 자체. 그 옛날 홍콩은 없는 영화 같지 않은 영화 밑도 끝도 없는 과장된 후반부 액션을 보려면 지루한 초중반까지 런닝타임을 버텨야할 듯! 그리웠던 과장된 홍콩 액션 40년 전 홍콩 무협의 추억이 돋고 액션도 화려하지만 모든게 너무 과해서 피곤하다 몰아치는 무협 액션 속 홍콩인들을 향한 헌사라는 태풍의 눈 구룡성채:무법지대 한번쯤 볼만은 합니다. 기대한 것은 무간도 결과물은 드레곤볼... 반가웠고 아쉬웠던 무협의 추억 구룡성은 간짜장이 최고~!!! 마작을 두기 위해 필요했던 멤버 복수 보단 의리가 좋은 이들의 맹량한 액션에 고천락의 바람은 큰 도움이 되었다 괴짜 같은 최종빌런은 웃음준다 향수가 듬뿍 묻어나오는 의리의 낭만 80년대 홍콩 무협에 대한 헌사이자 노스텔지어, 홍콩 영화의 광막한 성채 속 낭만과 상처가 고스란히. 옛날 홍콩 영화 느낌 좋았다 2024-10-31 / 067 / 그래! 이게 바로 홍콩 느와르지!!!!!!!! 배우들 너무 멋있다. 그 시절 무법지대였던 구룡성채에 대한 이야기를 보고싶다면, 홍콩 액션영화를 보고싶다면 추천하는 영화. 90년대 홍콩을 잘 표현했지만 주조연들의 발란스가 아쉽다 갑자기 서브조연이 제일 세다 이건 납득이 안감 중간에 스토리가 루즈해지는것도 아쉬움 앞 뒤 액션을 중간에도 좀 넣어주지 . 분쟁으로 쌓은 성채 안에서 맹렬하고 뜨겁게 몰아쳤던 바람. 그 바람이 다시 일어 새로운 연을 날려보다. 그래, 이게 우리가 좋아했던 홍콩 액션영화지! 홍콩 무협영화는 아직 안죽었다 여전히 그리워하는 팬들이 있다 홍콩영화의 황금기에 부치는 러브레터같은 영화 액션과 무협의 탈을 쓰고 구현하는 시대의 낭만과 우정 그리고 세대 교체 좋은점도 나쁜점도 80년대 홍콩영화 그대로, 그런데 왜때문에 굳이 구룡성채 너무 기대했나? 원하는 만큼 액션씬도 뽑아내지 못햇고 빌드업도 길고... 세대교체 앓이중 액션만큼은 올해 본 작품 중 최고 구룡성채 무법지대 말그대로 무법지대를 배경으로 펼쳐지는 강렬한 액션 영화. 다양한 액션과 장면으로 눈길을 사로잡고 끝까지 몰입할 수 있게 해준다. 그 속에 묘한 옛 홍콩영화에 대한 그리움도 담겼다. 무협을 가미한 액션씬들이 좋았고 구룡성채 세트도 좋았다. 비좁고 복잡한 이미지들 잘표현했다. 다만 자막이문제인데 사이클론,av,차단 등으로 무협영화인데 무협모르는 사람이 번역헀다. 지옥굴 같은 구룡성채도 따뜻한 집이 될 수 있다 옛 홍콩배우들과 현 젊은 배우의 세대를 아우르는 영화. 세대교체가 보인다고 할까.. 만화같은 무협액션씬이 볼 만하다. 옛 홍콩영화에 대한 추억이 있다면 더욱 재밌게 볼 수 있을 듯 80년대의 향수가 떠오르는 작품. 잠시나마 일상으로부터 벗어나 꿈같은 시간여행을 할 수 있었던 달콤한 순간이었습니다. 초대해주신 관계자분들께 감사드립니다. 오랜만의 시원한 홍콩액션 좋았어요. 화려한 홍콩식 액션 영화에 어설프게 끼어든 구룡성채 사람들의 이야기 사라져가는 것에 대한 영화인의 헌사 수호지의 양산박을 현대의 구룡성채를 따와 무협액션을 보여준다. 감독의 구룡성채에 대한 그리움을 잘표현했다. 홍콩 무협의 미래. 개연성을 벗어난 빌런은 좀 아쉬웠다. 그 홍콩에 그리움이 지나치다. 이것이 홍콩 액션이다. 줄거리는 그냥 싸움을 위한 핑계일뿐. 1980년대 홍콩 영화에 대한 낭만이 있어야 오글거림을 피하고 즐길 수 있다. 홍콩 무협영화의 회광반조 홍콩영화 레전드들의 귀환과 성공적인 세대교체, 액션과 낭만 모두 최대치로!! 홍콩영화의 새로운 시작을 꿈꾸다 진정으로 떠나보내는 홍콩의 시대 몇년새 나온 홍콩영화에 비해서는 잘 만든듯.. 추억돋는 홍콩느와르! 무법지대 속에 질서와 규칙 그리고 평화 그 시절 홍콩 낭만에 대한 헌사와 훌륭한 액션의 적당한 조화 뻔한 스토리를 밟고 일어서는 액션."
월래스와 그로밋 : 거대 토끼의 저주,"월레스와그로밋의환상콤비 월레스앤그로맛씨리즈는항상재미있어요 동심의 맛 어릴 적 추억들이 새록새록. 월래스와 그로밋 후속작 24년 나온다고 하는데 기대된다. 치이이즈~ 자세히 살펴보면 캐릭터에 지문이 묻어있다. 그 지문까지 사랑스러웠다. 다시 보고 싶은 영화 스톱 모션 애니메이션으로 이렇게 영화를 만들 수 있다는 것만으로도 충분히 예술적 가치가 높다. 사랑스러우면서도 공포스러운 토끼라니! 단편들의 장단점들이 장편으로 오니 극대화된다. 윌래스와 그로밋 추격씬은 역시나 진기명기. 기발한 아이디어와 아는만큼 보이는 각종 패러디들. 나이들고 보니, 여러가지로 대단한 작품이었잖아 유쾌함이 매력인 클레이 애니메이션. 아기자기한 맛의 흐뭇한 스릴러. 내 유년 시절을 함께한 이 별난 콤비는 여전히 건재하며, 유쾌하다. 장인의 손맛을 보아라 엔딩크레딧이 끝나고 뜬 문장까지 센스있다 평범한 영화였다. 뭐... 딱히 할말은 없다. (아! 스탑모션은 감탄했다.) 이렇게 야무진 강아지 치즈 여행을 떠나던 편 다음으로 재미있다. 충분히 즐겁고 사랑스럽다. 항상 그로밋 네가 고생이 많아~ 꿀잼ㅋㅋㅋ 9살짜리의 동심으로 이해하기엔 거대토끼가 무척이나 끔찍했다. 늘 고생이 많은 두 친구. 그래서 더욱 고마운. 환상의 콤비 월레스와 그로밋 단편의 매력이 의외로 장편에선 그렇게 통하지 않았지만, 그래도 이 분야의 대가인 것은 틀림 없는 사실. 1. 평점과 한 줄 평 5.0 아기자기한 맛만 남았다. 이번엔 무려 ""괴수물""이다! 월레스와 그로밋 시리즈의 가장 큰 장기인 장르 확장은 이번에도 차이를 만들어냈다. 세심한 디테일과 상상력 가득한 플롯, 그리고 (주인공과 빌런을 가리지... 그래도 채소는 먹기 싫어 클레이애니의 매력과 월레스와 그로밋 시리즈가 가지는 독특한 브로맨스 어드벤처에 흠뻑 빠진다. 하지만 단편들의 짧고 굵은 매력들을 길게 이어가기엔 약간 벅찼던 것 같다. 이제는 다 ..."
애프터 웨딩 인 뉴욕,"주도적인 삶을 살아가는 여성의 선택을 지지한다 결혼식 이후에 벌어지는 해프닝 정도로만 생각하고 영화를 봤는데 생각보다 많이 무겁게 느껴지는 영화. . 이 영화보면서 휴지를 찾게 될 줄은 꿈에도 생각을 못했다. . 주인공들의 입... 인생은 끊임없는 선택의 연속 그리고 딜레마 . 평범한 이야기도 줄리안 무어를 거치면 비범해진다 성별만 바뀌었지 원작에서 나아간 점은 전혀 없는 뭔가 나올듯할 말랑 하다가 끝나버렸다. 그리고 주인공들의 감정선은 따라가기 쉽지 않았다 긁어 부스럼을 만든 감독 테레사 시점의 묘사가 더 있어야 했다고 느꼈다 ""우리가 세상을 지나는 걸까, 세상이 우리를 지나치는 걸까."" 복잡한 관계 오랜만에 눈물나게하는 영화 세상에는 말과 경계로 딱 잘라서 표현할 수 없는 미묘한 관계들이 존재한다. 그러나 소재가 흥미롭다고 해서 영화가 모두 좋은 것은 아님을. 원작이 있음에도 불구하고 다수의 인물을 그... 각자가 지키고자 했던 둥지 품격 있는 출생의 비밀 이야기. 그리고 어떤 값진 선택에 대해서. 숏컷의 미셸 윌리임스 최고~~ 두 여배우의 연기호흡이 꽤 볼만하다. 내용은 알고보면 막장드라마... '애프터 웨딩 인 뉴욕'은 인도에서 고아원을 운영하고 있는 여인이 후원을 받기 위해 뉴욕으로 오며 후원자와 그 가족과 잃어버린 인연을 찾게 되는 드라마 영화다. 원작 영화를 안 본..."
